{"schema_version":"context_fabric_investigation_result.v1","result_id":"result_12345678","request_id":"request_12345678","generated_at":"1970-01-01T00:01:40Z","status":"complete","question":"What is the actual status of Ask Dev and what is driving it?","interpretation":{"shape":"open","requested_judgment":"release_readiness_and_drivers","time_context":{"axis":"current"},"fact_requirements":[{"kind":"status"},{"kind":"readiness"}],"clarification_needed":false},"subject_resolution":{"candidates":[],"committed":[]},"answer_plan":{"family":"unclassified","family_source":"none","family_version":"question-family.v4","require_drivers":false,"require_ranking":false,"fact_kinds":["status","readiness"],"axes":["expected_kind","subject_anchor","subject_handle","window","subject_candidate"],"budget":{"max_items":0,"max_serialized_bytes":1048576,"max_members":50,"synthesis_headroom":0,"narrowing_basis":"canonical_id_lexical"}},"direct_judgment":"Ask Dev is not ready to ship.","current_state":"Release-readiness blockers remain.","strongest_pressures":[],"drivers":[],"remaining_work":[],"readiness_gaps":[],"paths":[],"conflicts":[],"limitations":["workload: not read for this answer.","readiness: not read for this answer.","health: not read for this answer.","A candidate subject was identified but not committed: the evidence assembled for it does not support naming it as the answer to this question."],"evidence_ref_ids":[],"claimed_facts":[],"coverage":{"sources":[],"partial":true},"versions":{"service_version":"acr-test","contract_version":"context_fabric_investigation_result.v1","backend":"test","projection_version":"projection-v1","query_version":"query-v1","interpretation_version":"interpret-v1","synthesis_version":"synthesis-v1","canonical_service_version":"ops-v1","model_identity":"unwired"},"deterministic_answer":"Ask Dev is not ready to ship because release-readiness blockers remain.","warnings":[],"reused":false,"completeness":{"terminal_status":"complete","claimed_facts_count":0,"rows_count":0,"state":"not_derived"}}
