{
  "schema_version": "context_fabric_investigation_result.v1",
  "result_id": "result_12345678",
  "request_id": "request_12345678",
  "generated_at": "2026-09-11T14:00:00Z",
  "status": "degraded",
  "question": "What is the actual status of Ask Dev and what is driving it?",
  "interpretation": {
    "shape": "open",
    "requested_judgment": "status_and_drivers",
    "time_context": {
      "axis": "current"
    },
    "fact_requirements": [
      {
        "kind": "status"
      }
    ],
    "clarification_needed": false
  },
  "subject_resolution": {
    "candidates": [],
    "committed": [
      {
        "kind": "project",
        "canonical_id": "project_ask_dev",
        "label": "Ask Dev"
      }
    ]
  },
  "direct_judgment": "",
  "current_state": "",
  "strongest_pressures": [],
  "drivers": [],
  "remaining_work": [],
  "readiness_gaps": [],
  "paths": [],
  "conflicts": [],
  "limitations": [
    "No canonical fact for this question could be read in the requested window, so no answer is given."
  ],
  "evidence_ref_ids": [],
  "claimed_facts": [],
  "coverage": {
    "sources": [
      {
        "source": "canonical_fact:status",
        "state": "unavailable",
        "reason": "the status reader returned no row for this window"
      }
    ],
    "partial": false,
    "degraded_reasons": [
      "canonical_fact:status unavailable"
    ]
  },
  "versions": {
    "service_version": "acr-v1",
    "contract_version": "context_fabric_investigation_result.v1",
    "backend": "test",
    "projection_version": "projection-v1",
    "query_version": "query-v1",
    "interpretation_version": "interpret-v1",
    "synthesis_version": "synthesis-v1",
    "canonical_service_version": "ops-v1",
    "model_identity": "test/model-v1"
  },
  "deterministic_answer": "",
  "warnings": [],
  "reused": false,
  "completeness": {
    "terminal_status": "degraded",
    "terminal_reason": "degraded_reason_disclosed",
    "claimed_facts_count": 0,
    "rows_count": 0,
    "state": "not_derived"
  }
}
