{"schema_version":"context_fabric_investigation_result.v1","result_id":"result_12345678","request_id":"request_12345678","generated_at":"1970-01-01T00:01:40Z","status":"no_match","question":"What is the actual status of Ask Dev and what is driving it?","interpretation":{"shape":"open","requested_judgment":"release_readiness_and_drivers","time_context":{"axis":"current"},"fact_requirements":[{"kind":"status"},{"kind":"readiness"}],"clarification_needed":false},"subject_resolution":{"candidates":[],"committed":[]},"answer_plan":{"family":"unclassified","family_source":"none","family_version":"question-family.v5","require_drivers":false,"require_ranking":false,"fact_kinds":["status","readiness"],"axes":["expected_kind","subject_anchor","subject_handle","window","subject_candidate"],"budget":{"max_items":0,"max_serialized_bytes":1048576,"max_members":50,"synthesis_headroom":0,"narrowing_basis":"canonical_id_lexical"}},"direct_judgment":"","current_state":"","strongest_pressures":[],"drivers":[],"remaining_work":[],"readiness_gaps":[],"paths":[],"conflicts":[],"limitations":["Retrieval found no candidate for this question in this organization's graph, so no canonical facts were read. This search is not exhaustive, so it does not confirm that no matching subject exists."],"evidence_ref_ids":[],"claimed_facts":[],"coverage":{"sources":[],"partial":false},"versions":{"service_version":"acr-test","contract_version":"context_fabric_investigation_result.v1","backend":"unwired","projection_version":"unwired","query_version":"unwired","interpretation_version":"unwired","synthesis_version":"unwired","canonical_service_version":"unwired","model_identity":"unwired"},"deterministic_answer":"No investigation subject could be resolved for this question.","warnings":[],"reused":false,"effective_evidence_window":{"as_of":"1970-01-01T00:01:40Z","window_class":"state_snapshot","provenance":"server_default"},"completeness":{"terminal_status":"no_match","terminal_reason":"limitation_disclosed","claimed_facts_count":0,"rows_count":0,"state":"not_derived"}}
