{
  "schema_version": "context_fabric_investigation_result.v1",
  "result_id": "result_tuple_producer_001",
  "request_id": "req_00000000000000000000000000000001",
  "generated_at": "2026-09-14T12:00:00Z",
  "status": "complete",
  "question": "What is the state and count of this project's work items?",
  "interpretation": {
    "shape": "discovered_cohort",
    "requested_judgment": "status",
    "subject_terms": [
      "Project Alpha"
    ],
    "time_context": {
      "axis": "current"
    },
    "fact_requirements": [
      {
        "kind": "health"
      }
    ],
    "clarification_needed": false
  },
  "subject_resolution": {
    "candidates": [
      {
        "receipt_id": "receipt_tuple_project",
        "subject": {
          "kind": "project",
          "canonical_id": "project.v2:linear:P1",
          "label": "Project Alpha"
        },
        "state": "committed",
        "matched_terms": [
          "Project Alpha"
        ],
        "match_reasons": [
          "Exact canonical subject label match."
        ],
        "confidence": 1,
        "match_mechanisms": [
          "exact"
        ]
      }
    ],
    "committed": [
      {
        "kind": "project",
        "canonical_id": "project.v2:linear:P1",
        "label": "Project Alpha"
      }
    ],
    "commit_decision_digests": [
      {
        "subject": {
          "kind": "project",
          "canonical_id": "project.v2:linear:P1",
          "label": "Project Alpha"
        },
        "commit_gate": "identity_fast_path",
        "identity_proven": true
      }
    ]
  },
  "answer_plan": {
    "family": "scoped_cohort_status",
    "family_source": "model",
    "family_version": "question-family.v4",
    "member_kind": "work_item",
    "require_drivers": false,
    "require_ranking": false,
    "render_kinds": [
      "table"
    ],
    "fact_kinds": [
      "status",
      "work"
    ],
    "axes": [
      "subject_anchor",
      "expected_kind",
      "window"
    ],
    "budget": {
      "max_items": 50,
      "max_serialized_bytes": 262144,
      "max_members": 34,
      "synthesis_headroom": 16,
      "narrowing_basis": "canonical_id_lexical"
    },
    "requirements": [
      {
        "requirement": "count/member/work_item",
        "obligation": "count",
        "role": "member",
        "subject": "work_item",
        "kind": "computed",
        "scope": "each_member",
        "quantifier": "none",
        "unavailable": "computed_population_absent"
      },
      {
        "requirement": "health/member/work_item",
        "obligation": "health",
        "role": "member",
        "subject": "work_item",
        "kind": "read",
        "scope": "each_member",
        "quantifier": "none",
        "unavailable": "no_declaring_producer"
      },
      {
        "requirement": "state/member/work_item",
        "obligation": "state",
        "role": "member",
        "subject": "work_item",
        "kind": "read",
        "fact_kinds": [
          "status"
        ],
        "scope": "each_member",
        "quantifier": "corroborated"
      }
    ]
  },
  "cohort": {
    "kind": "work_item",
    "members": [],
    "rationale": "Work items are members of the resolved project within the authorized scope.",
    "complete": true,
    "truncated": false
  },
  "direct_judgment": "Counted 0 work items. This investigation is complete.",
  "current_state": "No canonical facts were observed to describe the current state.",
  "strongest_pressures": [],
  "drivers": [],
  "remaining_work": [],
  "readiness_gaps": [],
  "paths": [],
  "conflicts": [],
  "limitations": [
    "Members are the work items as of now; the period supplied with this request was not applied to the membership. Ask for work items created, completed or updated in that period to filter by one of those."
  ],
  "evidence_ref_ids": [],
  "claimed_facts": [
    {
      "claim_id": "server:cardinality:work_item",
      "kind": "cardinality",
      "subject": {
        "kind": "project",
        "canonical_id": "project.v2:linear:P1",
        "label": "project.v2:linear:P1"
      },
      "field": "work_item_count",
      "value": {
        "integer": 0
      }
    }
  ],
  "coverage": {
    "sources": [],
    "partial": false
  },
  "versions": {
    "service_version": "tuple-test",
    "contract_version": "context_fabric_investigation_result.v1",
    "backend": "graph",
    "projection_version": "projection-v1",
    "query_version": "query-v1",
    "interpretation_version": "schema-v1",
    "synthesis_version": "prompt-v1+model-v1",
    "canonical_service_version": "unwired",
    "model_identity": "test-provider/test-model",
    "interpretation_source": "server",
    "interpretation_model_identity": "test-provider/test-model",
    "synthesis_source": "server"
  },
  "deterministic_answer": "Counted 0 work items. This investigation is complete.",
  "warnings": [],
  "reused": false,
  "effective_evidence_window": {
    "start": "2026-06-16T00:00:00Z",
    "end": "2026-09-14T00:00:00Z",
    "relative_id": "trailing_90d",
    "provenance": "question_stated"
  },
  "completeness": {
    "terminal_status": "complete",
    "claimed_facts_count": 1,
    "rows_count": 0,
    "state": "degraded",
    "outcomes": [
      {
        "stage": "planning",
        "requirement": "count/member/work_item",
        "obligation": "count",
        "outcome": "unavailable",
        "impact": "dimension",
        "cause_coverage": "computed_population_absent",
        "cause_observed": true,
        "served": 0,
        "declared": 0
      },
      {
        "stage": "planning",
        "requirement": "health/member/work_item",
        "obligation": "health",
        "outcome": "not_applicable",
        "impact": "none",
        "cause_coverage": "fact_no_declaring_producer",
        "cause_observed": true,
        "served": 0,
        "declared": 0
      },
      {
        "stage": "planning",
        "requirement": "state/member/work_item",
        "obligation": "state",
        "outcome": "satisfied",
        "impact": "none",
        "cause_observed": false,
        "served": 0,
        "declared": 0
      },
      {
        "stage": "assembled_result",
        "requirement": "count/member/work_item",
        "obligation": "count",
        "outcome": "satisfied",
        "impact": "none",
        "cause_observed": false,
        "served": 0,
        "declared": 0
      },
      {
        "stage": "assembled_result",
        "requirement": "state/member/work_item",
        "obligation": "state",
        "outcome": "unavailable",
        "impact": "dimension",
        "cause_coverage": "requirement_read_not_planned",
        "cause_observed": false,
        "served": 0,
        "declared": 2
      }
    ]
  }
}
